{
  "personal_info": {
    "name": "MOHAMED AMINE ABBASSI",
    "email": "a.abbassi23072@pi.tn",
    "phone": "+21654051820",
    "location": "Tunis, Tunisia",
    "linkedin": "https://www.linkedin.com/in/amine-abbassi-7a9543175"
  },
  "summary": "string or null",
  "experience": [
    {
      "company": "Kothon Tech GmbH",
      "title": "Software Engineer",
      "start_date": "05/2025",
      "end_date": "10/2025",
      "responsibilities": [
        "Developed a cross-platform mobile application for Kothon Tech, focusing on delivering a seamless and responsive user experience.",
        "Implemented key features, integrated secure payment processing with Stripe, and optimized backend performance for scalability.",
        "Collaborated closely with designers and backend engineers to ensure smooth API communication and a consistent user interface across platforms."
      ],
      "achievements": [
        "string"
      ]
    },
    {
      "company": "Metta Startup Studio",
      "title": "AI Software Engineer",
      "start_date": "07/2025",
      "end_date": "10/2025",
      "responsibilities": [
        "Contributed to the development of a Marketing and Sales SaaS platform designed for early-stage founders, integrating AI-driven features to automate lead generation and enhance user engagement.",
        "Focused on building scalable and efficient backend logic while developing a responsive, user-friendly interface.",
        "Collaborated on improving data flow and system performance to support intelligent business insights."
      ],
      "achievements": [
        "string"
      ]
    },
    {
      "company": "Polytech-Intl",
      "title": "Computer Vision Developer",
      "start_date": "09/2024",
      "end_date": "12/2024",
      "responsibilities": [
        "Developed a Facial Emotion Recognition system using Python and Django, capable of detecting and classifying human emotions from facial expressions captured in natural environments.",
        "Integrated deep learning models, including a Convolutional Neural Network (CNN) and a VGG19-based model, trained on the FER2013 dataset to recognize multiple emotions.",
        "Included a web interface for uploading images and visualizing predictions, focusing on model performance, usability, and interpretability."
      ],
      "achievements": [
        "string"
      ]
    },
    {
      "company": "NEXT STEP",
      "title": "Software Engineer",
      "start_date": "07/2024",
      "end_date": "09/2024",
      "responsibilities": [
        "Developed an intuitive web interface for the Nuclei vulnerability scanner, aimed at simplifying the process of configuring and executing security scans.",
        "Allowed users to easily select, customize, and manage Nuclei templates, visualize scan results, and generate detailed security reports.",
        "Focused on making the tool accessible even to users with limited security experience, ensuring a clear, informative, and user-friendly interface."
      ],
      "achievements": [
        "string"
      ]
    },
    {
      "company": "Meki Business and IT Solutions",
      "title": "Web Developer",
      "start_date": "05/2024",
      "end_date": "08/2024",
      "responsibilities": [
        "Designed and implemented a modern, conversion-oriented user interface for a talent hiring platform connecting companies with elite Tunisian professionals.",
        "Focused on aligning the platform’s UX/UI design with the brand’s messaging, ensuring a cohesive visual identity and seamless user experience.",
        "Enhanced conversion-focused workflows and created intuitive interfaces tailored to the needs of different user roles, simplifying navigation and improving overall engagement across the platform."
      ],
      "achievements": [
        "string"
      ]
    }
  ],
  "education": [
    {
      "institution": "Faculty of Sciences of Tunis(FST)",
      "degree": "Bachelor",
      "field": "Computer Science",
      "graduation_date": "2020-2023"
    },
    {
      "institution": "Polytech-Intl",
      "degree": "Master",
      "field": "Software Engineering",
      "graduation_date": "2023-2025"
    }
  ],
  "skills": [
    "C/C++",
    "Java",
    "JavaScript",
    "TypeScript",
    "Python",
    "HTML5",
    "CSS3",
    "Spring Boot",
    "React",
    "Next.js",
    "Angular",
    "Node.js",
    "Express.js",
    "Django",
    "MongoDB",
    "MySQL",
    "PostgreSQL",
    "SQL",
    "AWS",
    "Git",
    "Docker",
    "Kubernetes",
    "Jenkins",
    "Kafka",
    "CI/CD pipelines"
  ],
  "certifications": [
    "string"
  ],
  "languages": [
    "English",
    "French",
    "Arabic"
  ],
  "raw_text": "MOHAMED AMINE ABBASSI\nSoftware Engineer\n+21654051820 amine-abbassi\n25 Taherlekhmiri St,\na.abbassi23072@pi.tn\nTunis,Tunisia\nEDUCATION\nEXPERIENCE\nBachelor of Computer Science\nSoftware Engineer 05/2025 – 10/2025\nFaculty of Sciences of Tunis(FST)\nKothon Tech GmbH l Munich, Germany\n2020-2023\nDeveloped a cross-platform mobile application for Kothon Tech, focusing on delivering a seamless\nMaster in Software Engineering and responsive user experience. Implemented key features, integrated secure payment processing\nwith Stripe, and optimized backend performance for scalability. Collaborated closely with designers\nPolytech-Intl\nand backend engineers to ensure smooth API communication and a consistent user interface across\n2023-2025\nplatforms.\nTech Stack: React Native,Node.js,Express.js,MongoDB,Stripe,AWS\nSKILLS\nAI Software Engineer 07/2025 – 10/2025\nMetta Startup Studio l Ericeira, Lisbon, Portugal\nProgramming languages:\nContributed to the development of a Marketing and Sales SaaS platform designed for early-stage\nC/C++, java, javascript, typescript,\nfounders, integrating AI-driven features to automate lead generation and enhance user\npython\nengagement. Focused on building scalable and efficient backend logic while developing a\nWeb Technologies: responsive, user-friendly interface. Collaborated on improving data flow and system performance\nto support intelligent business insights.\nHTML5, CSS3, Spring Boot,\nTech Stack: Next.js,Node.js,Express.js,Supabase,TypeScript,OpenAIAPI\nRESTful APIs, JSON, WebSockets\nComputer Vision Developer\n09/2024-12/2024\nFrameworks:\nPolytech-Intl | Tunis, Tunisia\nReact, Next.js, Angular, Node.js,\nDeveloped a Facial Emotion Recognition system using Python and Django, capable of detecting and\nExpress.js, Django, React Native,\nclassifying human emotions from facial expressions captured in natural (“in-the-wild”)\nBootstrap, Tailwind CSS environments. The application integrates deep learning models, including a Convolutional Neural\nNetwork (CNN) and a VGG19-based model, trained on the FER2013 dataset to recognize multiple\nDatabases:\nemotions such as happiness, sadness, anger, and surprise. The project included a web interface for\nMongoDB, My SQL, Postgre SQL, SQL\nuploading images and visualizing predictions, with a focus on model performance, usability, and\ninterpretability.\nServer, Supabase, Firebase\nTech Stack: Python,Django,Num Py,Pandas,Matplotlib,FER2013 Dataset\nDev Ops & Cloud:\nSoftware Engineer 07/2024-09/2024\nAWS, Git, Git Hub/Git Lab, Docker,\nNEXT STEP | Tunis, Tunisia\nKubernetes, Jenkins, Kafka, CI/CD\npipelines Developed an intuitive web interface for the Nuclei vulnerability scanner, aimed at simplifying the\nprocess of configuring and executing security scans. The platform allows users to easily select,\nTesting & Quality Tools:\ncustomize, and manage Nuclei templates, visualize scan results, and generate detailed security\nSonar Qube, Selenium, JMeter, reports. My focus was on making the tool accessible even to users with limited security experience,\nensuring a clear, informative, and user-friendly interface.\nBlaze Meter\nTech Stack: React.js,Node.js,Express.js,MongoDB,Flowbite,Tailwind CSS\nOther Tools & Concepts:\nWeb Developer 05/2024-08/2024\nStripe API, Webhooks, Agile/Scrum,\nPostman, Jira Meki Business and IT Solutions | Tunis, Tunisia\nDesigned and implemented a modern, conversion-oriented user interface for a talent hiring\nplatform connecting companies with elite Tunisian professionals. The project focused on aligning\nLANGUAGE\nthe platform’s UX/UI design with the brand’s messaging, ensuring a cohesive visual identity and\nseamless user experience. I enhanced conversion-focused workflows and created intuitive\nEnglish\ninterfaces tailored to the needs of different user roles, simplifying navigation and improving overall\nengagement across the platform.\nFrench\nTech Stack: React.js,Node.js,Express.js,MongoDB,Flowbite,Tailwind CSS\nArabic\nhttps://www.linkedin.com/in/amine-abbassi-7a9543175"
}